{
  "module": "conv_viterbi",
  "status": "FAIL",
  "check_type": "module",
  "compared_points": 51844,
  "max_error": 1,
  "tolerance": 0,
  "timestamp": "2026-06-14T03:29:07Z",
  "files": [
    {"role": "script", "path": "[CLAUDE_HOME]/knowledge/primary/domains/comm/convolutional-coding/golden_model/check_conv_decoder.py"},
    {"role": "rtl", "path": "[PROJECT_DIR]/01_src/viterbi_decoder_top.sv"},
    {"role": "tb", "path": "[PROJECT_DIR]/02_tb/tb_conv_viterbi.sv"},
    {"role": "golden", "path": "[PROJECT_DIR]/tv/"},
    {"role": "log", "path": "[PROJECT_DIR]/transcript"},
    {"role": "log", "path": "[CLAUDE_HOME]/knowledge/primary/domains/comm/convolutional-coding/evidence_report.json"}
  ],
  "duration_us": 1176444,
  "toolchain": {
    "simulator": "ModelSim DE-64 10.6c 2017.07",
    "python_version": "3.12.3"
  },
  "failed_points": [
    {"index": 3, "expected": 1, "actual": 0, "error": 1, "test": "TV2 encoder"},
    {"index": 4, "expected": 1, "actual": 0, "error": 1, "test": "TV2 encoder"},
    {"index": 5, "expected": 0, "actual": 1, "error": 1, "test": "TV2 encoder"},
    {"index": 8, "expected": 0, "actual": 1, "error": 1, "test": "TV2 encoder"},
    {"index": 9, "expected": 1, "actual": 0, "error": 1, "test": "TV2 encoder"},
    {"index": 11, "expected": 0, "actual": 1, "error": 1, "test": "TV2 encoder"},
    {"index": 203, "expected": 0, "actual": 1, "error": 1, "test": "TV2 encoder"},
    {"index": 204, "expected": 0, "actual": 1, "error": 1, "test": "TV2 encoder"},
    {"index": 205, "expected": 1, "actual": 0, "error": 1, "test": "TV2 encoder"},
    {"index": 208, "expected": 1, "actual": 0, "error": 1, "test": "TV2 encoder"},
    {"index": 7, "expected": 0, "actual": 1, "error": 1, "test": "TV4 encoder"},
    {"index": 8, "expected": 1, "actual": 0, "error": 1, "test": "TV4 encoder"},
    {"index": 10, "expected": 1, "actual": 0, "error": 1, "test": "TV4 encoder"},
    {"index": 11, "expected": 1, "actual": 0, "error": 1, "test": "TV4 encoder"},
    {"index": 12, "expected": 0, "actual": 1, "error": 1, "test": "TV4 encoder"},
    {"index": 13, "expected": 0, "actual": 1, "error": 1, "test": "TV4 encoder"},
    {"index": 14, "expected": 0, "actual": 1, "error": 1, "test": "TV4 encoder"},
    {"index": 17, "expected": 0, "actual": 1, "error": 1, "test": "TV4 encoder"},
    {"index": 19, "expected": 0, "actual": 1, "error": 1, "test": "TV4 encoder"},
    {"index": 20, "expected": 1, "actual": 0, "error": 1, "test": "TV4 encoder"},
    {"index": 1, "expected": 1, "actual": 0, "error": 1, "test": "TV6 punctured 3/4"},
    {"index": 3, "expected": 0, "actual": 1, "error": 1, "test": "TV6 punctured 3/4"},
    {"index": 5, "expected": 1, "actual": 0, "error": 1, "test": "TV6 punctured 3/4"},
    {"index": 8, "expected": 1, "actual": 0, "error": 1, "test": "TV6 punctured 3/4"},
    {"index": 9, "expected": 0, "actual": 1, "error": 1, "test": "TV6 punctured 3/4"},
    {"index": 3, "expected": 0, "actual": 1, "error": 1, "test": "TV7 rate 2/3"},
    {"index": 5, "expected": 0, "actual": 1, "error": 1, "test": "TV7 rate 2/3"},
    {"index": 7, "expected": 1, "actual": 0, "error": 1, "test": "TV7 rate 2/3"},
    {"index": 10, "expected": 0, "actual": 1, "error": 1, "test": "TV7 rate 2/3"},
    {"index": 12, "expected": 0, "actual": 1, "error": 1, "test": "TV7 rate 2/3"},
    {"index": 4, "expected": 0, "actual": 1, "error": 1, "test": "TV7 rate 3/4"},
    {"index": 6, "expected": 0, "actual": 1, "error": 1, "test": "TV7 rate 3/4"},
    {"index": 9, "expected": 1, "actual": 0, "error": 1, "test": "TV7 rate 3/4"},
    {"index": 11, "expected": 0, "actual": 1, "error": 1, "test": "TV7 rate 3/4"},
    {"index": 12, "expected": 1, "actual": 0, "error": 1, "test": "TV7 rate 3/4"},
    {"index": 2, "expected": 0, "actual": 1, "error": 1, "test": "TV7 rate 5/6"},
    {"index": 5, "expected": 0, "actual": 1, "error": 1, "test": "TV7 rate 5/6"},
    {"index": 7, "expected": 1, "actual": 0, "error": 1, "test": "TV7 rate 5/6"},
    {"index": 10, "expected": 0, "actual": 1, "error": 1, "test": "TV7 rate 5/6"},
    {"index": 11, "expected": 1, "actual": 0, "error": 1, "test": "TV7 rate 5/6"},
    {"index": 3, "expected": 0, "actual": 1, "error": 1, "test": "TV7 rate 7/8"},
    {"index": 4, "expected": 1, "actual": 0, "error": 1, "test": "TV7 rate 7/8"},
    {"index": 5, "expected": 0, "actual": 1, "error": 1, "test": "TV7 rate 7/8"},
    {"index": 7, "expected": 1, "actual": 0, "error": 1, "test": "TV7 rate 7/8"},
    {"index": 8, "expected": 1, "actual": 0, "error": 1, "test": "TV7 rate 7/8"}
  ]
}
